,start_time,end_time,wav_file,emotion,val,act,dom,text,label
7712,113,115.28,Ses04M_script03_1_F018,exc,2.5,3.5,3,"Don't say that, darling.",5
7715,162.9098,171.5798,Ses04M_script03_1_F021,exc,4,4,4.5,"Yes, meaning just that.",5
7716,173.64,175.61,Ses04M_script03_1_F022,exc,4,3.5,3,"What does it all mean?  That's what I ask myself in my ceaseless quest for ultimate truth.  Dear God, what does it all mean?",5
7717,178.7,183.8,Ses04M_script03_1_F023,exc,5,4.5,4,Don't laugh at me.  I'm serious.,5
7718,184.54,190.15,Ses04M_script03_1_F024,exc,3,4,4,"You mustn't be serious, my dear.  That's just what they want.",5
7719,191.06,193.6,Ses04M_script03_1_F025,exc,4,3.5,3,Who's they?,5
7720,197.53,201.52,Ses04M_script03_1_F026,exc,4,4,3.5,All the futile moralists who try to make life unbearable.  Laugh at them.  Be flippant.  Laugh at everything.  All their sacred shibboleths.  Flippancy brings out the acid- acid in their damn sweetness and light.,5
7721,204.99,207.75,Ses04M_script03_1_F027,exc,3.5,3.5,3.5,"If I laugh at everything, I must laugh at us, too.",5
7722,208.6,215.23,Ses04M_script03_1_F028,exc,4.5,4.5,4,Certainly you must.  We're figures of fun alright.,5
7723,218.31,222.65,Ses04M_script03_1_F029,exc,4.5,4.5,4.5,"How long will it last, this ludicrous and overbearing love of ours?",5
7724,225.08,227.4261,Ses04M_script03_1_F030,exc,4,3.5,3.5,Who knows.,5
7728,15.7076,19.15,Ses04M_script03_1_M003,neu,3.5,3,3.5,It all depends on how well we've played.,0
7729,20.7,22.87,Ses04M_script03_1_M004,exc,3,3,3.5,"What happens if one of us dies?  Does the one that's left, still laugh?",5
7731,31.27,34.02,Ses04M_script03_1_M006,exc,3,3.5,4,"Well that's serious enough, isn't it?",5
7732,34.97,37.45,Ses04M_script03_1_M007,exc,3,3.5,3.5,"No, no, it isn't.  Death's very laughable; such a cunning little mystery, all done with mirrors.",5
7735,50.43,54.1,Ses04M_script03_1_M010,neu,3,3,3.5,"Let's savor the delight of the moment.  Come and kiss me, darling, before your body rots and worms pop in and out of your eye sockets.",0
7737,66.55,69.83,Ses04M_script03_1_M012,neu,2.5,3,3.5,"I don't mind what you do, see?  You can paint yourself bright green all over and dance naked in the Place Vendome and rush off madly with all the men in the world and I shan't say a word as long as you love me best.",0
7738,70.26,84.45,Ses04M_script03_1_M013,ang,2.5,4,4.5,"Thank you, dear.  The same applies to you, except that if I catch you so much as looking at another woman, I will kill you.",2
7741,99.5976,103.11,Ses04M_script03_1_M016,sad,2,3,3,The one when you bought that little painted wooded snake and put it on my bed?,3
7746,139.1744,147.1219,Ses04M_script03_1_M021,exc,3.5,3.5,4.5,It went on intermittently for days.,5
7750,183.3,185.21,Ses04M_script03_1_M025,ang,2,3.5,4.5,How -- that was a rouser wasn't it?,2
7753,201.3627,203.34,Ses04M_script03_1_M028,neu,2.5,1.5,2,"The manager came in and found is rolling about on the floor, biting and scratching like panthers.  Oh, dear.",0
7754,203.4,205.5,Ses04M_script03_1_M029,exc,3,3.5,3.5,"Ah, I shall never forget his face.",5
7758,226.9,231.71,Ses04M_script03_1_M033,neu,3,3.5,4,"As a matter of fact, the real cause of that row was Peter Burden.",0
7759,12.1431,14.74,Ses04M_script03_2_F000,ang,2.5,3.5,3,"That was a rouser, wasn't it?",2
7760,15.75,22.067,Ses04M_script03_2_F001,hap,4.5,3,2.5,That was the first time you ever hit me.,4
7761,23.38,27.23,Ses04M_script03_2_F002,hap,4.5,3.5,2.5,I didn't hit you very hard.,4
7762,27.65,29.89,Ses04M_script03_2_F003,hap,4,3,2.5,"The manager came in and found us rolling about on the floor, biting and scratching like panthers.  Oh, dear.",4
7765,42.26,46.67,Ses04M_script03_2_F006,exc,4,3.5,3,We were very much younger then.,5
7767,54.74,58.56,Ses04M_script03_2_F008,hap,4,2.5,2.5,"As a matter of fact, the real cause of that row was Peter Burden.",4
7768,61.01,62.04,Ses04M_script03_2_F009,neu,3,3,2,You knew there was nothing in that.,0
7769,63.32,65.0737,Ses04M_script03_2_F010,ang,2.5,3,3,I knew nothing of the sort.  You took presents from him.,2
7771,70.89,74.8193,Ses04M_script03_2_F012,fru,4,3,3.5,"I remember it well, bristling with diamonds in the worst possible taste.",1
7772,75.92,78.74,Ses04M_script03_2_F013,fru,2,3.5,2.5,Not at all.  It was very pretty.  I still have it and I wear it often.,1
7773,82.03,83.9324,Ses04M_script03_2_F014,ang,2.5,3.5,2.5,You went out of your way to torture me over Peter Burden.,2
7774,85.69,90.08,Ses04M_script03_2_F015,fru,2,3,3.5,I did not.  You made the whole thing up in your jealous imagination.,1
7775,93.46,98.23,Ses04M_script03_2_F016,fru,2,3.5,3,"You must admit that he was in love with you, wasn't he?",1
7776,104.05,107.0655,Ses04M_script03_2_F017,ang,2.5,2.5,2.5,"Just a little, perhaps, nothing serious.",2
7777,110.55,112.43,Ses04M_script03_2_F018,fru,1.5,3.5,3,Line?,1
7778,112.86,114.4688,Ses04M_script03_2_F019,ang,1.5,4,3.5,Let him kiss you.,2
7779,119.98,123.14,Ses04M_script03_2_F020,fru,2.5,3.5,3,You let him kiss you.  You said you did.,1
7781,131.57,133.22,Ses04M_script03_2_F022,ang,2,4,3,What of it?,2
7782,133.34,135.67,Ses04M_script03_2_F023,ang,2,3.5,3,It gave him a lot of pleasure and it didn't hurt me.,2
7783,139.78,141.2266,Ses04M_script03_2_F024,neu,2.5,2,2,What about me?,0
7784,144.56,148.48,Ses04M_script03_2_F025,fru,2,3.5,3.5,"If you hadn't been so nosey, you never would have known a thing about it.",1
7785,154.87,157.44,Ses04M_script03_2_F026,ang,2.5,3,3.5,"That's a nice point of view, I must say.",2
7786,160.72,162.2,Ses04M_script03_2_F027,fru,2,3,3,"Oh, dear.  I'm bored with this conversation.",1
7787,162.26,168.53,Ses04M_script03_2_F028,ang,2,4.5,3.5,So am I; bored stiff.,2
7788,171.25,173.849,Ses04M_script03_2_F029,ang,2.5,3,3.5,You want some brandy?,2
7789,175.84,178.69,Ses04M_script03_2_F030,ang,2,3,3.5,"No, thanks.",2
7790,191.15,195.16,Ses04M_script03_2_F031,ang,2,3.5,3,"I'll have a little myself, I think.",2
7791,196.01,197.95,Ses04M_script03_2_F032,ang,3,3.5,3,I don't see why you want it.  You've already had two glasses.,2
7792,206.71,212.1477,Ses04M_script03_2_F033,ang,2,4,3.5,"No particular reason.  Anyhow, they were very small ones.",2
7793,216.7,218.66,Ses04M_script03_2_F034,ang,2,2.5,3.5,It seems so silly to go on and on and on with such a thing.,2
7794,224.92,228.29,Ses04M_script03_2_F035,ang,2,3.5,3,You can hardly call three liquor glasses in a whole evening going on and on and on.,2
7795,232.75,235.0415,Ses04M_script03_2_F036,ang,2,3.5,2.5,It's become a habit with you.,2
7796,238.12,242.2,Ses04M_script03_2_F037,ang,3.5,3.5,3,You needn't be so grand just because you don't happen to want any at the moment.,2
7798,249.36,252.1562,Ses04M_script03_2_F039,ang,2,3.5,3.5,"Really, Amanda",2
7799,253.27,257.25,Ses04M_script03_2_F040,ang,2.5,3.5,3.5,What?,2
7800,258.71,261.9019,Ses04M_script03_2_F041,ang,1.5,4,3.5,Nothing.,2
7801,263.25,268.4503,Ses04M_script03_2_F042,ang,2,4,3,"Going out somewhere, my dear?",2
7802,269.12,270.9465,Ses04M_script03_2_F043,neu,2,2,1.5,"No, just making myself fascinating for you",0
7803,271.8356,276.57,Ses04M_script03_2_F044,ang,1.5,4,3.5,Oh.  That reply has broken my heart.,2
7804,278.33,279.09,Ses04M_script03_2_F045,ang,2,4.5,2.5,"The woman's job is to allure the man.  Watch me a minute, will you?",2
7805,279.12,284.3,Ses04M_script03_2_F046,ang,1.5,4,3,"As a matter of fact, that's perfectly true.",2
7806,284.33,288.18,Ses04M_script03_2_F047,ang,2,3.5,3.5,"Oh, no, it isn't.",2
7807,288.38,289.75,Ses04M_script03_2_F048,ang,2,4,3.5,"Yes, it is.",2
7808,289.77,295.21,Ses04M_script03_2_F049,ang,1.5,4.5,4,"Oh, be quiet.",2
7809,295.22,296.72,Ses04M_script03_2_F050,ang,1.5,5,3,Line?,2
7810,296.73,300.79,Ses04M_script03_2_F051,ang,1.5,4.5,4,It's a pity you didn't- It's a pity you didn't have more brandy.,2
7811,300.82,302.35,Ses04M_script03_2_F052,ang,1.5,4.5,3.5,It's a pity you didn't have any more brandy.  It might have made you a little less disagreeable.,2
7813,14.12,16.17,Ses04M_script03_2_M001,neu,3,2.5,2,Line?,0
7816,29.37,32.64,Ses04M_script03_2_M004,fru,3,3,2.5,"They -- nonsense, they have a little bag of venom behind their fangs and they snap.",1
7817,33.82,36.97,Ses04M_script03_2_M005,fru,2.5,3.5,3,They sting.,1
7819,46.07,49.23,Ses04M_script03_2_M007,fru,2,3.5,3,I don't care.  Do you understand?  I don't care.  I don't mind if they bark and roll about like hoops.,1
7820,51.9,55.17,Ses04M_script03_2_M008,ang,2,3,2.5,Did you see much of Peter Burden after our divorce?,2
7821,60.02,61.2951,Ses04M_script03_2_M009,neu,2.5,1.5,0.5,"Yes, I did, quite a lot.",0
7822,61.73,63.89,Ses04M_script03_2_M010,ang,2,4,3,"I suppose you let him kiss you a good deal more then, hmm?",2
7823,64.3898,66.47,Ses04M_script03_2_M011,ang,2,4.5,3,Mind your own business.,2
7824,69.58,71.41,Ses04M_script03_2_M012,ang,2,4.5,2.5,You must have had a riotous time.,2
7825,74.3577,77.1,Ses04M_script03_2_M013,ang,2,3,2.5,"No restraint at all, very enjoyable.  You never had much anyhow.",2
7826,77.75,80.5642,Ses04M_script03_2_M014,ang,2.5,3.5,2.5,You're quite insufferable.  I expected it's because you're drunk.,2
7828,83.4879,86.19,Ses04M_script03_2_M016,fru,3,2,2.5,You always had a weak head.,1
7829,89.84,93.89,Ses04M_script03_2_M017,fru,3,3,2.5,I think I mentioned once before that I've only had three minute liquor glasses of brandy this whole evening.  That's hardly enough to get a child of two drunk.,1
7830,97.66,104.6,Ses04M_script03_2_M018,fru,2.5,2.5,3,"On the contrary, a child of two could get violently drunk on only one glass of brandy.",1
7831,106.26,111.34,Ses04M_script03_2_M019,fru,2,3.5,2.5,Very interesting.  And how about a child of four and a child of six and a child of nine?,1
7832,112.02,113.62,Ses04M_script03_2_M020,ang,2,3.5,3,"Oh, shut up.",2
7833,113.9046,116.14,Ses04M_script03_2_M021,ang,2.5,4,3,"We might get up a splendid little- a splendid little debate about this, you know, intemperate tots.",2
7834,117.81,120.42,Ses04M_script03_2_M022,ang,2.5,3,2.5,"Not very funny, dear.  You'd better have some more brandy.",2
7835,122.26,126.08,Ses04M_script03_2_M023,fru,2.5,2.5,2,Very good idea.  I will,1
7836,129.84,132.55,Ses04M_script03_2_M024,ang,2.5,3.5,2.5,You better turn that off I think.,2
7837,132.59,133.93,Ses04M_script03_2_M025,ang,3.5,3,3,Why?,2
7838,136.4393,138.02,Ses04M_script03_2_M026,neu,2.5,2,1.5,It's late and the people upstairs will get annoyed.,0
7839,140.93,145.08,Ses04M_script03_2_M027,ang,2.5,3.5,3.5,There aren't any people upstairs.  It's a photographer's studio.,2
7840,149.64,151.79,Ses04M_script03_2_M028,neu,2.5,2,2,"There are people downstairs, I suppose",0
7841,151.83,155.36,Ses04M_script03_2_M029,ang,2.5,3.5,3,They're away in Tunis.,2
7842,157.03,161.43,Ses04M_script03_2_M030,ang,2.5,3.5,3.5,This is no time of year for Tunis.,2
7843,161.49,162.75,Ses04M_script03_2_M031,ang,2,4,3.5,"Turn it on again, please.",2
7845,173.44,176.83,Ses04M_script03_2_M033,ang,2,2.5,3.5,"Very well, if you insist on being boorish and idiotic.",2
7846,180.04,184.2,Ses04M_script03_2_M034,ang,2.5,3,3,Turn it off.  It's driving me mad.,2
7847,186.05,191.63,Ses04M_script03_2_M035,ang,2.5,3,3.5,Go away.  Go away.  I hate you.,2
7848,194.73,196.53,Ses04M_script03_2_M036,ang,2,4,3.5,Turn it off.,2
7849,197.36,207.1039,Ses04M_script03_2_M037,fru,2.5,3.5,3,You are far too temperamental.  Try to control yourself.,1
7850,211.5664,217.03,Ses04M_script03_2_M038,ang,2.5,2.5,3.5,We swapped. Listen.,2
7852,227.36,229.96,Ses04M_script03_2_M040,ang,2.5,3.5,3.5,"Listen, indeed.  I am sick and tired of listening to you, you damn sadistic bully.",2
7853,230.5277,233.24,Ses04M_script03_2_M041,ang,2.5,3.5,3.5,"You're a vile tempered, loosed living",2
7855,241.6583,244.74,Ses04M_script03_2_M043,ang,2.5,2.5,3,wicked little beast. And I- I hope I never see you again as long as live.,2
7858,256.91,259.11,Ses04M_script03_2_M046,ang,1.5,4,3.5,You're not going like this.,2
7859,261.3,263.54,Ses04M_script03_2_M047,ang,2,4.5,4,"Oh, yes, I am.",2
7860,270.8098,272.0237,Ses04M_script03_2_M048,ang,2.5,3.5,3,"No, you're not.",2
7861,276.14,278.8,Ses04M_script03_2_M049,ang,1.5,3,3,"Let go of me.  You're a cruel fiend and I hate and loath you.  Thank God, I discovered in time what you're really like.",2
7862,278.84,284.04,Ses04M_script03_2_M050,ang,1.5,4.5,4,Shut up. Shut up.,2
7863,287.38,289.16,Ses04M_script03_2_M051,ang,2,3.5,4,"You're a mean, evil minded",2
7864,289.27,290.35,Ses04M_script03_2_M052,ang,2.5,4.5,4,Marry you again? Huh.,2
7865,291.15,293.05,Ses04M_script03_2_M053,ang,1.5,4,4,little vampire And I hope to God I never set eyes on you as long as I live.,2
7866,293.08,295.43,Ses04M_script03_2_M054,ang,1.5,4,4,"Never, never, never.  I'd rather die in torment. Beast brute.",2
7867,295.6698,300.36,Ses04M_script03_2_M055,ang,1.5,4,4,Whore.,2
7868,300.39,302.31,Ses04M_script03_2_M056,ang,1.5,4.5,4.5,Swine.,2
7869,3.6132,6.17,Ses05F_impro01_F000,neu,4,2.5,3,"Hi, I need an ID.",0
7870,14.15,19.49,Ses05F_impro01_F001,fru,2.5,3,3,"ahh Yeah, this is the wrong line.  I'm sorry.  You need to go back over to line two B.  That's where you should have started from.",1
7871,22.85,26.9,Ses05F_impro01_F002,fru,2.5,3,3.5,"Okay, I'm sorry, but I just stood in this line for an hour.  can I Is there any way I can-",1
7872,29.98,34.46,Ses05F_impro01_F003,fru,2.5,3,3,"I mean, there's really nothing I can do for you in this line.  This is not the line for new I.D.  This is the line for registration.",1
7873,39.48,42.18,Ses05F_impro01_F004,fru,2.5,3.5,3,"No, they told me-I'm sorry, but they told me to be in this line.",1
7874,42.84,45.78,Ses05F_impro01_F005,fru,2.5,3.5,3,"Yeah, I understand that ma'am.  I don't know what they said to you, but you need to be in a different line.",1
7875,46.82,53.74,Ses05F_impro01_F006,fru,2,3.5,4,"What, I mean what... what's the difference?  What do I need to do there that I can't do here?",1
7876,58.28,65.33,Ses05F_impro01_F007,fru,2,3.5,4,"Well, I have no camera here.  I can't help you at all here, ma'am.  I have forms for something completely different.  You need to go to a different place.",1
7877,65.34,69.58,Ses05F_impro01_F008,neu,2,3.5,3.5,Can you just-can I just get the right-,0
7878,74.06,76.68,Ses05F_impro01_F009,fru,1.5,3,3.5,"Simply step to line two A, ma'am, I'm sorry.",1
7879,86.89,88.5,Ses05F_impro01_F010,fru,1.5,3.5,3.5,Would you be able to put me at the front of that line?,1
7880,88.52,91.5428,Ses05F_impro01_F011,fru,2,3,3.5,There is a large line of people behind you waiting to be--,1
7881,96.25,101.6,Ses05F_impro01_F012,fru,2,3.5,4,I know.  I've been in line with these people.  I understand.  I understand what it's like.  Could you please like call over and-,1
7882,117.86,128.73,Ses05F_impro01_F013,fru,2,3.5,4,"I don't want to be rude here, ma'am, but line two B is where you need to be.  This is the line for registration.",1
7883,130.3,134.77,Ses05F_impro01_F014,fru,2,4,4.5,"I hear that.  I hear that.  Thank you, but I've waited in line for so long, and I don't want to have to be here all day.",1
7884,135.38,136.73,Ses05F_impro01_F015,fru,2.5,3,3,I don't have those-,1
7885,136.76,140.55,Ses05F_impro01_F016,fru,1.5,3.5,4.5,"So could I maybe get the form from you, fill it out here- and maybe you could-",1
7886,144.68,150.7,Ses05F_impro01_F017,ang,1.5,4,4,"I don't have those forms, ma'am.  I can't help you.  That's why you need to go to line two A.",2
7887,150.95,152.51,Ses05F_impro01_F018,ang,1.5,4,4,And how long is that going to take?,2
7888,154.96,159.55,Ses05F_impro01_F019,fru,2,4,4,"Ma'am, obviously I have no idea how long it's taking.  There seems to be a bit of a line there.  It looks like thirty forty people.  It could take four to five hours.  I'm sorry.",1
7889,160.01,164.82,Ses05F_impro01_F020,ang,2,3,4,I don't-,2
7890,167.25,169.38,Ses05F_impro01_F021,fru,2,3,3.5,"There's nothing I can do for you, ma'am.",1
7891,171.71,174.13,Ses05F_impro01_F022,fru,2,3,3.5,"I don't have time for this today, and-",1
7892,179.52,181.6059,Ses05F_impro01_F023,fru,2,3,2.5,"But, obviously I don't have time for you to stand here and waste my time in this line.  There are other people who need service behind you who are waiting for the right things.",1
7893,5.78,14.78,Ses05F_impro01_M000,neu,2.5,2.5,4,"Is there anything you can do?  Please, have some compassion.  Is there something you can do?",0
7896,34.11,40.88,Ses05F_impro01_M003,neu,2,4,3.5,"Please, I don't think that's necessary.  I'm just asking, maybe you could call over and say that somebody miss informed her because I didn't pick to stand in this line.  I asked them where to stand, and they told me here.",0
7897,41.11,44.39,Ses05F_impro01_M004,fru,2,4,4,"what, no, I'm sure they did not tell you here.",1
7898,44.42,48.16,Ses05F_impro01_M005,fru,2,4,4,"No, they did.  The lady over there told me to stand in this line and I've been here for an hour.",1
7899,52.11,59.09,Ses05F_impro01_M006,fru,2,3.5,4.5,"what The lady, what? the janitor?",1
7900,67.69,69.34,Ses05F_impro01_M007,fru,2,3,3,No.,1
7901,69.37,74.36,Ses05F_impro01_M008,fru,2,4,4,"You asked the janitor what line to stand in?  Obviously, that's not going to be the right thing.",1
7902,76.16,87.3,Ses05F_impro01_M009,fru,1.5,3.5,4,"No, I'm not, I'm sorry.I'm not stupid.",1
7903,87.6,89.6,Ses05F_impro01_M010,fru,2.5,3.5,3.5,"I'm not saying that you're stupid, ma'am.  I think you just said that you were stupid.",1
7904,91.31,99.88,Ses05F_impro01_M011,fru,1.5,3.5,4.5,Isn't there anything you can do?  Just call over and ask them if I can go to the front of the line in the other line.,1
7905,100.52,110.6,Ses05F_impro01_M012,fru,1.5,4,4.5,"It doesn't work that way here, ma'am.",1
7906,111.08,118.47,Ses05F_impro01_M013,fru,1.5,4,4.5,Why not?,1
7907,127.97,131.11,Ses05F_impro01_M014,fru,2,4,4,There is a strict system here.  You need to wait in the right line for the right thing.  This is the line for registration.,1
7908,132.11,135.5,Ses05F_impro01_M015,fru,2,3.5,4,"Except they're going tell, are you going to tell me the right line to stand in this time at least?",1
7910,140.15,145.88,Ses05F_impro01_M017,fru,2,3,4,"Right, well, last time they told me, it was this line, and obviously, it's not true.",1
7911,149.42,151.69,Ses05F_impro01_M018,fru,2,4,4,I don't know who told you that but they were wrong.  I'm sorry.,1
7912,151.7151,157.73,Ses05F_impro01_M019,fru,2.5,4,4,Do you have a manager I could speak with?,1
7913,158.43,161.22,Ses05F_impro01_M020,fru,2,3.5,3.5,I am the manager.,1
7914,163.35,167.67,Ses05F_impro01_M021,fru,2,3.5,4,Are you being straight with me?,1
7916,173.52,179.84,Ses05F_impro01_M023,fru,2,4,4.5,Fine.,1
7919,12.3,14.48,Ses05F_impro02_F001,sad,2,1.5,1.5,What is it?,3
7920,19,24.66,Ses05F_impro02_F002,sad,2,2.5,1.5,um.,3
7922,28.8,31.1014,Ses05F_impro02_F004,sad,1.5,2,1.5,I'm sorry.  It's just a lot ahh to explain. ahh I got a call--,3
7923,33.64,37.13,Ses05F_impro02_F005,sad,1.5,2,2,Are you all right?,3
7926,51.74,54.42,Ses05F_impro02_F008,sad,1.5,3.5,1.5,okay.,3
7927,61.57,65.73,Ses05F_impro02_F009,sad,1,3,1.5,I'm going to need to go overseas for a while.,3
7928,68.83,79.79,Ses05F_impro02_F010,sad,2,2.5,2,You got called up.,3
7929,83.05,85.3,Ses05F_impro02_F011,sad,2,2.5,1.5,Iraq.,3
7930,88.33,93.3,Ses05F_impro02_F012,sad,1.5,2.5,2,I thought you said this wasn't going to happen for at least a year.,3
7931,97.74,103.85,Ses05F_impro02_F013,fru,2,2.5,1.5,"I'm sorry.  I thought so. ""sigh""",1
7932,106.68,109.98,Ses05F_impro02_F014,fru,1.5,3,2.5,What am I going to do?,1
7935,133.58,138.14,Ses05F_impro02_F017,fru,1.5,2.5,2,The kids-,1
7936,140.62,144.2,Ses05F_impro02_F018,fru,2,3.5,2.5,I know.  I know.,1
7938,156.43,158.23,Ses05F_impro02_F020,fru,2,1.5,1,"I know.  Well, we'll have to figure all that out.  I mean, I think the Army's going to provide childcare and help us out with that. um.",1
7939,164.25,167.39,Ses05F_impro02_F021,sad,1.5,3.5,1.5,Where do you have to go?  Where are you going?,3
7941,183.02,188.9,Ses05F_impro02_F023,sad,1,3.5,2,What are you going to do there?  Is it going to be dangerous?  What are you-?,3
7942,199.56,202.78,Ses05F_impro02_F024,sad,1.5,1.5,1.5,I think infantry.  I'm not sure.,3
7943,205.98,213.17,Ses05F_impro02_F025,fru,1.5,3.5,3,It's--,1
7944,223.63,233.5,Ses05F_impro02_F026,fru,2,3,3.5,Can we do something else?  Can you tell them that you just had two kids?,1
7945,238.65,240.41,Ses05F_impro02_F027,sad,1.5,3,2,"It's going to be at least six months, probably a year. I tried.",3
7946,246.35,248.2,Ses05F_impro02_F028,sad,1.5,3.5,2,I don't understand why they would just do something like this?,3
7947,252.21,262.69,Ses05F_impro02_F029,sad,2,2.5,2.5,"I know, I know.  It's really, really messed up.",3
7949,285.79,289.17,Ses05F_impro02_F031,sad,1,4,1.5,"Believe me, if I had a choice, I wouldn't have chosen this.",3
7950,291.05,294.92,Ses05F_impro02_F032,sad,1,3,2,I don't know I don't know what I'm going to do.  I don't know how to-,3
7952,307.54,310.21,Ses05F_impro02_F034,sad,2.5,2,2,"They're six months old. Six months old, they're tiny.",3
7953,311.9,316.1,Ses05F_impro02_F035,sad,2,2,1.5,I can't do this.  I've never done this before.  I don't know anything about this.,3
7954,318.97,320.71,Ses05F_impro02_F036,sad,2,1,1,"Well, maybe you should move in with my mom and she can help.",3
7955,328.2,329.4,Ses05F_impro02_F037,sad,2,1,1,"Your Your mom, you want me to move in with your mom?",3
7956,335.2658,343.4,Ses05F_impro02_F038,sad,1.5,3.5,1.5,"I don't know, I'm just--I'm trying to think of something.",3
7957,7.6018,10.43,Ses05F_impro02_M000,neu,3,2.5,1.5,She doesn't even like me.  She's never liked me. No.,0
7961,38.49,40.68,Ses05F_impro02_M004,ang,1.5,2.5,1,You can't what?,2
7962,41.89,44.97,Ses05F_impro02_M005,ang,1.5,2.5,2,I can't let you go.  I can't let you go.  I'll call them.  I'll say something.  I'll do anything.  I'll tell them something different.,2
7963,50.1,52.32,Ses05F_impro02_M006,fru,1.5,3,1,I don't think there's anything we can do.,1
7965,60.35,61.9,Ses05F_impro02_M008,fru,1.5,3,1.5,"Well, we can try it.  Baby, don't beg me.  I mean, if there were anything that I could do, I would do it.  Believe me.  This is not what I want.",1
7967,80.46,83.44,Ses05F_impro02_M010,ang,2,3.5,2.5,I know.  I know it's not fair.,2
7971,103.9163,108.13,Ses05F_impro02_M014,ang,1.5,3.5,2.5,"I don't know.  Baby, why are you asking me this?  It's just as hard for me.  Please, try to understand that.",2
7972,109.4,116.86,Ses05F_impro02_M015,ang,1.5,4,3.5,"I don't know.  It's not me, so I'm the one who has to stay here.  I'm the one who has to take care of them, and I don't have-I don't have anybody else.  You're all I have.",2
7973,120.58,125.54,Ses05F_impro02_M016,fru,1.5,2.5,2,"I understand, baby.  I'm sorry. I mean try to understand I'm I'm scared myself.",1
7981,166.05,169.52,Ses05F_impro02_M024,sad,1.5,3.5,1.5,Maybe we should call your parents.,3
7982,181.75,183.73,Ses05F_impro02_M025,sad,1,3.5,1,Yeah.  I guess.  I don't know what they're going to say.,3
7983,189.28,200.16,Ses05F_impro02_M026,sad,1.5,3.5,1.5,"Yeah, we'll call them.  We'll figure something out.  I'm sorry, I'm sorry, I'm sorry.  You're right.",3
7986,233.41,240.23,Ses05F_impro02_M029,sad,1.5,3,1,You'll have to send me pictures and letters everyday.,3
7988,249.9654,252.0563,Ses05F_impro02_M031,sad,1.5,1.5,1,I don't know. I hope so.,3
7989,262.98,264.82,Ses05F_impro02_M032,sad,1.5,3.5,1,You have to call me all the time whenever you can.  You have to tell me what you're doing and how you're doing.  Okay?,3
7990,269.52,278.85,Ses05F_impro02_M033,sad,1.5,3,1,"Yeah, as much as I can.",3
7991,280.43,286.69,Ses05F_impro02_M034,sad,2,2.5,1.5,How long do we have?  When do you leave?,3
7992,289.05,291.18,Ses05F_impro02_M035,sad,1.5,3.5,1.5,"""sigh"" Three weeks.",3
7993,293.41,299.99,Ses05F_impro02_M036,sad,1.5,3,2,Three weeks?,3
7998,332.823,335.1399,Ses05F_impro02_M041,sad,2,2.5,2,"I love you.  I'm going to miss you so much. ""sigh""",3
7999,2.8098,4.5479,Ses05F_impro03_F000,exc,4,3,3.5,"Okay, so big news.",5
8000,7.96,9.84,Ses05F_impro03_F001,exc,4.5,3,3.5,What?,5
8001,10.2,11.33,Ses05F_impro03_F002,exc,4.5,3,4,"Come on, what?",5
8002,11.58,12.7187,Ses05F_impro03_F003,exc,4.5,3.5,4,I'm getting married.,5
8003,13.48,14.66,Ses05F_impro03_F004,exc,4.5,3.5,4,Shut up.,5
8004,16.25,18.16,Ses05F_impro03_F005,exc,4.5,3.5,4,Yeah.,5
8006,24.05,25.76,Ses05F_impro03_F007,exc,4.5,3,4,Yeah.,5
8007,26.06,30.77,Ses05F_impro03_F008,exc,4.5,4,3.5,He asked you?,5
8008,30.94,32.47,Ses05F_impro03_F009,exc,4.5,4,4,Uh-huh.,5
8010,40.12,41.87,Ses05F_impro03_F011,exc,4.5,4.5,4,Just a couple days ago.,5
8019,89.88,93.05,Ses05F_impro03_F020,exc,4.5,3.5,4.5,Yeah.,5
8026,110.89,117.44,Ses05F_impro03_F027,hap,4.5,3,4,It was really beautiful.,4
8027,120.49,121.75,Ses05F_impro03_F028,hap,4.5,4.5,3.5,You've got to love that.,4
8028,123.75,129.86,Ses05F_impro03_F029,hap,4,3.5,4,"Yeah, we went to a really great jazz show, and um-",4
8029,129.89,132.45,Ses05F_impro03_F030,hap,4,3.5,4,"Nice, you love the jazz.",4
8030,132.61,133.91,Ses05F_impro03_F031,hap,4,2,3,"Yeah, and after, we went up to this um, this place like a restaurant on the roof kind of thing.",4
8031,136.47,137.56,Ses05F_impro03_F032,hap,4,3,3,"Oh, okay, yeah.",4
8032,138.44,140.43,Ses05F_impro03_F033,hap,4,3,4,So you know like late dinner and champagne and what not.,4
8033,147.11,150.05,Ses05F_impro03_F034,hap,4,3.5,3.5,Were you in Chicago?,4
8034,158.06,159.28,Ses05F_impro03_F035,hap,4.5,3,3,Mm-hmm.,4
8035,165.32,167.36,Ses05F_impro03_F036,hap,5,4.5,4.5,"Downtown, was it beautiful? of course it was beautiful",4
8036,167.67,170.06,Ses05F_impro03_F037,exc,4.5,3.5,4.5,"so beautiful, full moon.",5
8038,187.31,189.64,Ses05F_impro03_F039,hap,4.5,4,4,I don't know.  I guess next summer.,4
