,start_time,end_time,wav_file,emotion,val,act,dom,text,label
2307,30.23,32.51,Ses02F_script01_2_M004,neu,2.6667,2.6667,2.6667,But Kate--,0
2308,35.89,37.61,Ses02F_script01_2_M005,neu,3,2.6667,2,"Because if he's not coming back, I'll kill myself.  I mean, laugh--laugh at me, but...",0
2309,39.01,40.9,Ses02F_script01_2_M006,neu,3,2.6667,2.6667,But why did that happen the very night she came here?  She sleeps in his room and his memorial breaks to pieces.  Just look.  Look at it.,0
2310,42.92,44.86,Ses02F_script01_2_M007,neu,3,2,3,Calm yourself.,0
2311,53.21,55.56,Ses02F_script01_2_M008,neu,2.6667,1.6667,2.6667,"Believe with me, Joe.  I can't stand all alone.",0
2312,63.92,66.82,Ses02F_script01_2_M009,fru,3,3,2.6667,Calm yourself.,1
2313,74.43,76.68,Ses02F_script01_2_M010,fru,2.6667,3,2.6667,"Last week, a man turned up in Detroit missing longer than Larry.  I mean, you read it yourself.",1
2314,83.8,85.07,Ses02F_script01_2_M011,fru,3,2.3333,2.6667,All right.  All right.  Calm yourself.,1
2315,95.76,97.43,Ses02F_script01_2_M012,fru,3,2.6667,4,"You, above all, have to believe.",1
2316,100.21,102.12,Ses02F_script01_2_M013,fru,3,2.3333,3,What?- Why- Why me above all?,1
2317,104.9,107.82,Ses02F_script01_2_M014,fru,3,3,3.6667,Just--just don't stop believing.,1
2319,114,116.5,Ses02F_script01_2_M016,ang,1.6667,3.3333,3.3333,Look at you.  Look at you shaking.,2
2320,116.61,118.93,Ses02F_script01_2_M017,ang,1.6667,3,4,I can't help it.,2
2321,119.43,123.89,Ses02F_script01_2_M018,ang,2,3,4,What have I got to hide?  What the hell is the matter with you Kate?,2
2331,61.54,64.12,Ses02F_script01_3_F009,sad,3,3,3.5,"You saw that.  I mean and then, well, you've been kind of, um--",3
2334,115.79,118.542,Ses02F_script01_3_F012,hap,3.5,2.5,2.5,"The trouble is, I planned on sort of sneaking up on you over a period of a week or so.  But, they take it for granted that we're all set.",4
2335,121.03,123.45,Ses02F_script01_3_F013,hap,4,3,2.5,"I knew they would, your mother anyway.",4
2336,124.82,126.7,Ses02F_script01_3_F014,hap,4.5,3,3.5,"Well,",4
2338,146.24,154.84,Ses02F_script01_3_F016,hap,4.5,5,4.5,"Oh.  Would you want to?  I guess you know, this is why I asked you to come.",4
2342,176.8257,185.92,Ses02F_script01_3_F020,sad,2.5,2,3.5,I'm embarrassing you and I didn't want to tell it to you here.  I wanted some place we'd never been before.  A place where we'd be brand new to each other.,3
2343,191.13,193.3241,Ses02F_script01_3_F021,sad,3,3.5,3.5,"You feel it's wrong here, don't you?  This yard, this chair.  I want you to be ready for me.  I don't want to have to win you away from anything.",3
2344,196.69,198.64,Ses02F_script01_3_F022,sad,2,2,3,"Oh, Chris, I've been ready for a long, long time.",3
2345,206.99,208.41,Ses02F_script01_3_F023,sad,3.5,2,2.5,And he's gone forever.  You're sure?,3
2346,211.6,213.3,Ses02F_script01_3_F024,sad,3,2.5,2.5,I almost got married two years ago.,3
2347,215.8937,217.6679,Ses02F_script01_3_F025,sad,2,2,3,Why didn't you?,3
2348,331.43,333.69,Ses02F_script01_3_F026,sad,2.5,2,2.5,You started to write me and--,3
2351,357.69,360.06,Ses02F_script01_3_F029,hap,4.5,3.5,3.5,"Anne, why didn't you let me know?",4
2353,19.38,21.03,Ses02F_script01_3_M001,neu,3.5,2.5,2.5,"Give me a kiss, Anne.  Give me a-",0
2362,100.4,109.93,Ses02F_script01_3_M010,exc,3,3,4,No.  Nothing like that.,5
2372,173.5779,176.7,Ses02F_script01_3_M020,sad,2,2.5,3.5,Just about all.,3
2373,186.58,191.15,Ses02F_script01_3_M021,sad,3,2,3.5,"Oh, gee.",3
2374,193.87,196.2,Ses02F_script01_3_M022,sad,2,2.5,3.5,It takes some time for a guy to toss that off.  'Cause they weren't just men.,3
2375,200.09,207.24,Ses02F_script01_3_M023,sad,2.5,2.5,3.5,"For instance, one time, it had been raining several days and this kid came to me and gave me his last pair of dry socks.  I put them in pocket.  It's only a little thing, but that's the kind of guys I had.",3
2376,209.23,211.38,Ses02F_script01_3_M024,sad,2,2.5,3,"They didn't die, they killed themselves for each other.  I mean that exactly.  A little more selfish and they'd have been here today.",3
2377,214.07,215.64,Ses02F_script01_3_M025,sad,2,2,3,"I got this idea watching them go down.  Everything was being destroyed, see, but it seemed that there was one new thing being made.  A sort of responsibility.  Man for man.",3
2378,218.09,223.28,Ses02F_script01_3_M026,sad,2.5,3,4,"You know what I mean?  To show that, to bring that onto the Earth again, like some kind of monument and everyone would feel it standing behind him and it would make a difference to him.",3
2379,224.16,238.3,Ses02F_script01_3_M027,sad,3,3.5,4,Then I came back and it was incredible.  There was no meaning in it here.  The whole thing to them seemed like sort of a bus accident.  I went to work with Dad and that rat race again.,3
2380,238.37,247.36,Ses02F_script01_3_M028,sad,2,3,4,"And I felt what you said, ashamed somehow 'cause nobody was changed at all.  It seemed to make suckers out of a lot of guys.  I felt wrong to be alive to open the new bank book, drive the new car, see the new refrigerator.",3
2381,247.94,261.65,Ses02F_script01_3_M029,sad,3,3.5,5,"I mean, you can take those things out of a war, but when you drive that car, you've gotta know that it came out of the love a man can have for a man.  You've gotta be a little better because of it.",3
2382,261.69,273.34,Ses02F_script01_3_M030,sad,3,4,5,Because otherwise all you have is really loot and there's blood on it.  And I didn't want to take any of it.  And I guess that included you.,3
2383,274.75,290.06,Ses02F_script01_3_M031,sad,2,3,4.5,You still feel that way?,3
2384,290.35,307.67,Ses02F_script01_3_M032,sad,2,3,4.5,I want you now Annie.,3
2385,308.71,320.45,Ses02F_script01_3_M033,sad,3,3,4.5,"'Cause you mustn't feel that way.  Because you have a right to everything that you have.  Do you understand that?  Everything, Chris, and me too.",3
2386,320.83,330.73,Ses02F_script01_3_M034,sad,2,3,4.5,"I mean, and your money, there's nothing wrong with your money.  I mean, your father put hundreds of planes in the air.  A man should be paid for that.",3
2390,39.39,40.57,Ses02F_script02_1_F001,neu,2,2.5,3,"This is great, isn't it?  Look at the night we've got here, couldn't be better.",0
2394,72.69,73.97,Ses02F_script02_1_F005,neu,3,2,2.5,Is that--no--is that just foam?  I can't even tell.,0
2396,102.21,104.84,Ses02F_script02_1_F007,fru,2,2.5,3.5,"How you doing?  Aw, you know what I forgot?  I forgot to bring my flashlight.  Oh, how could I be so stupid?  I should've brought my flashlight.",1
2402,143.19,150.19,Ses02F_script02_1_F013,fru,2,4,4.5,"Oh, well sure.",1
2403,161.39,168.6,Ses02F_script02_1_F014,fru,2,2.5,3.5,"You kept saying my flashlight, if as if somehow it's just yours.  I mean is that supposed to make me feel?",1
2404,169.86,171.27,Ses02F_script02_1_F015,fru,2,2.5,3.5,"Right, of course.  Our flashlight.  Mine and yours.  I mean, me flashlight is su flashlight naturally.",1
2405,185.8,187.54,Ses02F_script02_1_F016,fru,2,3,3.5,How could we forget to bring it?  I hope the moon stays out.,1
2407,201.77,211.47,Ses02F_script02_1_F018,fru,2,4,4,Yeah.,1
2408,212.71,214.93,Ses02F_script02_1_F019,neu,2.5,3,3,"You cold?  Do you want my jacket?  Oh, we should've brought the blanket.  Our blanket.",0
2410,287.68,289.17,Ses02F_script02_1_F021,neu,3.5,2,3,I can't believe I forgot.  I'm like a kid.  It's amazing I got out of the house with my fly zipped.,0
2412,5.29,8.89,Ses02F_script02_1_M000,exc,3.5,3,3.5,I'm cold.,5
2413,8.9,13.03,Ses02F_script02_1_M001,exc,4,3.5,4,Do you want my jacket?,5
2414,13.07,19.18,Ses02F_script02_1_M002,exc,3,3.5,3.5,"It's after eleven, let's just go home.",5
2415,19.22,20.31,Ses02F_script02_1_M003,exc,4,3,3.5,Are you kidding?  We'd miss it.  We just got here.  What's the point of coming down here if we just turn around and go home.,5
2416,21.4,26.65,Ses02F_script02_1_M004,exc,3,2.5,3.5,There is no point in coming down here.,5
2417,26.69,31.43,Ses02F_script02_1_M005,exc,4,3.5,3.5,Right.,5
2418,31.47,39.69,Ses02F_script02_1_M006,exc,3,4,4,That's my point.,5
2421,49.01,50.5,Ses02F_script02_1_M009,neu,2.5,2.5,2,No. No. That's not my point.  The point is there's no point in coming down if we just leave.  Don't you want to see it?,0
2422,55.37,62.4,Ses02F_script02_1_M010,neu,3.5,3.5,4,Not particularly.,0
2424,68.15,72.9,Ses02F_script02_1_M012,neu,3,3,3.5,I just don't.  It's stupid.,0
2425,74.16,79.71,Ses02F_script02_1_M013,neu,4,3.5,4,"Honey, this is a natural phenomenon.  I mean this only happens once a year, you know.",0
2426,80.27,85.85,Ses02F_script02_1_M014,exc,4,3,4,"Think about the people in Kansas, they had to get plane tickets and hotel reservations to see this.  We live forty minutes away.  It's too good to pass up.",5
2427,85.9,91.25,Ses02F_script02_1_M015,exc,4,4,4,"Pass up what?  These little fish swim onto the beach, they flop around, and swim away.  And then they die.",5
2428,93.45,98.21,Ses02F_script02_1_M016,exc,3,3,4.5,"Yeah, but that moment on the beach, is the highlight of their little lives.  All that flopping is laying eggs or what do you--spawning or mating.  I mean,",5
2429,100.6,102.03,Ses02F_script02_1_M017,neu,2.5,3.5,3,this is a big night for these guys.  Life's last orgy.,0
2431,113.3,114.19,Ses02F_script02_1_M019,neu,3.5,2.5,2.5,Yeah they do.,0
2432,115.1,116.6,Ses02F_script02_1_M020,neu,3.5,2.5,3,"Ah, Augie.",0
2433,117.83,124.59,Ses02F_script02_1_M021,neu,2.5,3,4,Alright.  But it's fish that do something that none of the other fish do.  Like the swallows returning to Capistrano or the lemmings throwing themselves off the cliffs.,0
2436,136.89,143.85,Ses02F_script02_1_M024,exc,4,3.5,4,For real?,5
2437,149.67,159,Ses02F_script02_1_M025,exc,3.5,4,4,Yeah.,5
2438,159.05,162.01,Ses02F_script02_1_M026,exc,3,3.5,4.5,"I don't get it.  The first time we came here, you said it was the best night of your life.",5
2439,168.72,170.35,Ses02F_script02_1_M027,fru,3.5,3.5,3.5,"And last year, I remember specifically you were so excited to go that you stubbed your toe rushing me out of the house and didn't even notice until we got in the car.",1
2440,171.23,179.63,Ses02F_script02_1_M028,exc,3.5,3.5,4,"Last year, you will also remember our shoes got wet, I got sand in my panties, you got a sore throat, we got in a big fight over nothing, and we didn't see the grunions.",5
2443,190.28,194.78,Ses02F_script02_1_M031,neu,2.5,4,4,"We just weren't in a good spot.  This is a much better spot.  Believe me, I've got good instincts for these things.",0
2445,211.43,213.08,Ses02F_script02_1_M033,neu,2.5,3,3,"Oh man, this is great, isn't it?  I wouldn't miss this for anything.  Here, think about this, all right, I know you're not interested, but think about this.",0
2447,220.63,225.08,Ses02F_script02_1_M035,exc,2.5,3.5,3.5,"They don't know why, we don't know why.  Nobody sent them an invitation or a map, it wasn't a decision, just-",5
2448,225.14,233.26,Ses02F_script02_1_M036,exc,4,4,4,"all as one, this time release instinctual little firecracker went off and they all turned and formed a line as long as the California coast and started swimming.  And they're swimming right now as if that's all that matters.",5
2451,247.17,261.54,Ses02F_script02_1_M039,exc,3.5,4,4.5,"Ah, God, I'm giving myself goose bumps.  Look, all my hairs are popped up.",5
2452,261.74,271.7,Ses02F_script02_1_M040,exc,3.5,3.5,4.5,That's the wind.,5
2453,271.71,280.18,Ses02F_script02_1_M041,exc,4,3.5,4.5,"Well, so what do you think?",5
2454,280.21,284.64,Ses02F_script02_1_M042,exc,4,4,3.5,About what?,5
2455,285.95,287.87,Ses02F_script02_1_M043,neu,3,3,3,What I was saying.,0
2456,288.8,290.29,Ses02F_script02_1_M044,neu,3,3,3,It's ridiculous.,0
2457,6.33,7.72,Ses02F_script02_2_F000,neu,2.5,2,2.5,"Well, so what do you think?",0
2458,9.5015,11.26,Ses02F_script02_2_F001,fru,2.5,3.5,2.5,About what?,1
2462,45.21,52.65,Ses02F_script02_2_F005,ang,1.5,4.5,4.5,It's PR.  Somebody sold you a bill of goods that this wonderful event is gonna take place on the beach.,2
2463,53.2,57.7,Ses02F_script02_2_F006,ang,2,4,4,"Well, I'm not the only one.  Look at all these people.",2
2464,67.31,70.98,Ses02F_script02_2_F007,fru,1.5,4,3.5,"Sure, everybody's told the same story.  It keeps us all excited.  It keeps us coming back for more.  It keeps us thinking that life is gonna start any second now if we could just find the right spot and get in on the action.",1
2465,71.75,75.23,Ses02F_script02_2_F008,fru,2,4,3.5,Are we talking about the same thing?,1
2466,76.89,79.73,Ses02F_script02_2_F009,fru,2,3.5,4,"Well, I'm sorry, but it's still just fish to me.",1
2467,80.77,86.15,Ses02F_script02_2_F010,fru,2,4,4.5,"Carla, can I ask you something?  Don't take this wrong, but are you having your period?",1
2468,86.16,99.71,Ses02F_script02_2_F011,ang,1.5,5,5,"God damn it, Augie, don't ask me that.  I hate it when you ask me that.  You always ask me that.  It's insulting.",2
2469,101.28,103.81,Ses02F_script02_2_F012,fru,2,3.5,3.5,"Well, what's bugging you?",1
2470,104.93,111.9,Ses02F_script02_2_F013,fru,1.5,4,4.5,We just have different ideas of what this evening is supposed to look like.,1
2472,143.69,149.72,Ses02F_script02_2_F015,sad,2.5,3,4,"For heaven sake, we're not going to see the grunions.",3
2473,149.74,159.76,Ses02F_script02_2_F016,sad,4,4,3.5,Why not?,3
2474,159.7833,169.32,Ses02F_script02_2_F017,sad,3.5,4,4.5,"We never do, do we?  I mean, have we ever?",3
2475,169.34,178.17,Ses02F_script02_2_F018,sad,4,4.5,4,We've missed them twice.  That's not ever.,3
2476,178.78,183.33,Ses02F_script02_2_F019,sad,4,4,4,Twice is every time we've tried. That's ever.,3
2477,196.73,202.01,Ses02F_script02_2_F020,sad,2.5,3,3.5,"Well, we'll see them this year.",3
2478,206.41,207.55,Ses02F_script02_2_F021,sad,2.5,2,2.5,"No, we won't.  It's pointless.  It's like waiting up to see Santa Claus.",3
2479,208.74,209.72,Ses02F_script02_2_F022,sad,2.5,2.5,2,"I mean, I feel like my whole life is gonna be spent standing on the beach with my eyes wide open and my hands clasped expectantly waiting for the fish to show up.  And the fish won't show up.",3
2481,213.2,214.07,Ses02F_script02_2_F024,sad,2,2,2.5,You don't understand anything I'm saying.,3
2482,215.21,216.2,Ses02F_script02_2_F025,fru,2.5,2,2.5,"No, of course not.",1
2483,217.41,218.68,Ses02F_script02_2_F026,fru,2,3.5,3.5,I did want to see it.  I always do.  I keep thinking that this is gonna be the time and it never is.,1
2484,218.93,220.14,Ses02F_script02_2_F027,fru,2,4,4,It's just fish.  Nothing to get traumatized about.,1
2488,281.5765,286.6,Ses02F_script02_2_F031,sad,1.5,4,3.5,"You said, ""Hey the grunion are running tonight.""  I said, ""Great, let's go.  I feel lucky.""",3
2490,305.38,308.72,Ses02F_script02_2_F033,sad,2.5,3.5,3,"Do you remember the first time we came to see it?  It was about four years ago, right after we got married.",3
2491,308.75,324.1,Ses02F_script02_2_F034,sad,1.5,3,3.5,"I thought I was pregnant, you had a bottle of champagne, but no glasses.  You asked me to dance, so we kicked off our shoes and you popped the cork.",3
2492,327.15,328.77,Ses02F_script02_2_F035,sad,2,2,2.5,"And while we were dancing, you said the softest, most intimate things to me right into my ear so that I could feel them as much as hear them.",3
2495,342.08,350.2,Ses02F_script02_2_F038,sad,1.5,3,4.5,"Just dancing barefoot in the sand, drinking champagne out of the bottle.",3
2498,379.87,382.76,Ses02F_script02_2_F041,hap,4,4,3.5,I'd rather not remember some things.  I would rather not hope for some things.,4
2499,383.7,387.6,Ses02F_script02_2_F042,hap,4,3,3.5,"Okay, yeah, sure, I see it now.  Listen, you wanna dance?",4
2500,393.41,402.26,Ses02F_script02_2_F043,hap,4,3,3.5,No.,4
2501,405.93,408.26,Ses02F_script02_2_F044,sad,2.5,3.5,3.5,You want me to go get some champagne?,3
2502,412.15,413.92,Ses02F_script02_2_F045,hap,4,2.5,2.5,No.,4
2503,4.27,6.3631,Ses02F_script02_2_M000,exc,3.5,3.5,3.5,Take off our shoes?,5
2504,7.76,9.07,Ses02F_script02_2_M001,neu,3,3.5,3,No. No.,0
2505,11.44,15.53,Ses02F_script02_2_M002,neu,2.5,3.5,4,"Well, what?  You want me to breathe in your ear?",0
2506,21.24,23.66,Ses02F_script02_2_M003,neu,2.5,3.5,3,No.,0
2508,38.73,45.56,Ses02F_script02_2_M005,neu,3,3,2.5,No.,0
2509,51.79,53.51,Ses02F_script02_2_M006,fru,2.5,3.5,4,What?  What?  You want a divorce?,1
2510,57.55,67.72,Ses02F_script02_2_M007,neu,2.5,4,4,No.,0
2511,70.67,72.09,Ses02F_script02_2_M008,fru,2.5,3,3,A vacation?,1
2512,75.04,77.45,Ses02F_script02_2_M009,neu,2,3,3,No.,0
2513,79.4,81.13,Ses02F_script02_2_M010,neu,2.5,3.5,3.5,"A new carpet?  A poodle?  Ice cream?  Back rub?  A suicide pact?  What?  What?  Carla, what the hell do you want?",0
2514,99.67,101.5,Ses02F_script02_2_M011,fru,2.5,2.5,2.5,I want something to turn out the way that it's supposed to.,1
2515,103.58,105.17,Ses02F_script02_2_M012,fru,1.5,3,4,"Well, welcome to the human race.  Do you think this is what I had in mind when I proposed?  That four years down the road, we'd be at the beach yelling at each other over fish?",1
2516,111.46,114.75,Ses02F_script02_2_M013,neu,2.5,3,3.5,"No.  You think I knew that there'd be times when you'd look at me like a used Kleenex?  Or that I'd look at you and think, holy hell, when's the next flight to Alaska?",0
2517,115.92,124.08,Ses02F_script02_2_M014,fru,2,4,3.5,"No, Carla, I'm just like you.  I thought it was gonna be all peaches and roses and sand in our toes and wind in our hair and the fish will always come and the bills will pay themselves and we'll have three fat rosy kids and ha, ha, baby, the joke's on us",1
2519,134.1,138.81,Ses02F_script02_2_M016,neu,3,4,4,This.  What?  What is this?  This isn't even anything.,0
2520,138.86,144.92,Ses02F_script02_2_M017,neu,3,4,3.5,"Yes, it is.",0
2521,177.56,179.38,Ses02F_script02_2_M018,neu,4,3.5,3.5,"Uh, right this is standing on the beach.  This is waiting.  This is fighting.",0
2522,183.18,192.22,Ses02F_script02_2_M019,neu,3,4,4,Right.,0
2523,192.25,197.07,Ses02F_script02_2_M020,neu,3,4,4,Well.  This isn't anything like I thought anything would be like.,0
2524,201.32,206.74,Ses02F_script02_2_M021,neu,3,3.5,3.5,"I know, me neither.",0
2525,207.51,209.49,Ses02F_script02_2_M022,neu,3,3.5,3,"I mean, this is just this.  It includes a lot and everything, but it isn't something else.  Do you have any idea what I'm trying to say?",0
2526,209.57,211.32,Ses02F_script02_2_M023,neu,3,3.5,2.5,I'm doing the best I can.,0
2527,211.39,213.94,Ses02F_script02_2_M024,fru,2,3.5,2.5,"I know that, Augie.  Really, I do.",1
2528,213.99,215.86,Ses02F_script02_2_M025,fru,3,3.5,2.5,"I know that you meant this to be special and nice and the sand and the moon and all, but I just couldn't help thinking about being somewhere else.",1
2529,215.9,218.36,Ses02F_script02_2_M026,fru,2,3.5,3,Maybe if you were with somebody else too.,1
2530,218.41,219.74,Ses02F_script02_2_M027,fru,2,3.5,3.5,I didn't say that.,1
2531,219.75,226.54,Ses02F_script02_2_M028,fru,2,4,4,"No, I know.  But still.  I know I don't make you happy.",1
2532,228.2,238.96,Ses02F_script02_2_M029,ang,2,4.5,4.5,"Oh, for heaven sake, whatever I'm doing, I'd rather be doing it with you.",2
2534,250.89,266.43,Ses02F_script02_2_M031,sad,2.5,3,4,"Oh, don't be ridiculous.  I mean, don't you know that?",3
2535,266.44,269.39,Ses02F_script02_2_M032,fru,2,3.5,4,You're the one who probably wishes you were with someone else.  Someone who--you'd rather enjoy yourself and didn't take everything so hard.,1
2536,273.82,275.08,Ses02F_script02_2_M033,neu,3,2.5,3,"Well, now that you mention it.  No, I don't.",0
2537,280.13,281.22,Ses02F_script02_2_M034,neu,2.5,2.5,4,"Okay.  Fine so.  We're in the wrong spot, but we're with the right person.",0
2538,286.33,288.29,Ses02F_script02_2_M035,sad,2.5,3,3,"I don't know.  It seemed like a pretty good spot to me.  I mean, look at the view you have of the moon from here.",3
2539,302.93,305.06,Ses02F_script02_2_M036,sad,2,2.5,3.5,"Yeah, I noticed that.  Looks pretty, doesn't it?  Big ol' white moon.",3
2540,325.06,327.93,Ses02F_script02_2_M037,sad,2,2.5,3.5,"Well, look what we have here.",3
2541,328.38,333.71,Ses02F_script02_2_M038,sad,2,3,3,"Augie, you brought refreshments.",3
2544,364.81,370.56,Ses02F_script02_2_M041,hap,4,3,3,You still cold?  Do you wanna go home?,4
2545,378.28,380.21,Ses02F_script02_2_M042,hap,4,3.5,3.5,No.  I think you might be right.  Maybe this is the spot after all.,4
2546,382.43,384.08,Ses02F_script02_2_M043,hap,4,3,3,"Augie, I'm sorry.",4
2548,407.08,411.69,Ses02F_script02_2_M045,hap,3.5,2.5,3.5,Or not.,4
2549,414.05,415.64,Ses02F_script02_2_M046,hap,4,3,2.5,Or not.,4
2555,28.4,32.45,Ses02F_script03_1_F005,exc,3.6667,4,2.3333,What're we gonna do?,5
2556,34.49,36.76,Ses02F_script03_1_F006,hap,4,3.3333,1.6667,"We're all right, darling, aren't we?  Whatever happens.",4
2557,37.7,41.55,Ses02F_script03_1_F007,hap,4,3.3333,2.3333,"Now and always, sweet.",4
2558,45.23,48.88,Ses02F_script03_1_F008,hap,2.6667,2.3333,2,I don't care then.,4
2559,49.65,53.32,Ses02F_script03_1_F009,hap,2.6667,2.6667,2.6667,It was bound to come sooner or later.,4
2560,56.38,58.73,Ses02F_script03_1_F010,hap,3.3333,2,3,Hello?  Hello?  What?  Wrong number.,4
2562,70.51,71.76,Ses02F_script03_1_F012,neu,3.6667,2.3333,2.6667,What do we do if they suddenly walk in on us?,0
2563,81.78,84.79,Ses02F_script03_1_F013,neu,3.6667,2.6667,2.3333,Behave exquisitely.,0
2564,86.93,92.26,Ses02F_script03_1_F014,neu,4,2.6667,2,With the most perfect poise?,0
2565,93.31,96.54,Ses02F_script03_1_F015,neu,3.6667,2.3333,2.3333,"Oh, of course.  I shall probably do a court curtsy.",0
2566,99.04,101.35,Ses02F_script03_1_F016,neu,3.3333,2.6667,2,Things that ought to matter dreadfully don't matter at all when one's happy.  Do they?,0
2567,103.02,109.24,Ses02F_script03_1_F017,neu,2.6667,3,2.3333,What's so horrible is that one can't stay happy.,0
2569,117.52,119.97,Ses02F_script03_1_F019,hap,4,3.3333,2.6667,It's true.  The whole business is a very poor joke.,4
2570,140.2,142.43,Ses02F_script03_1_F020,hap,3.3333,2.6667,3,"Meaning that sacred and beautiful thing, love?",4
2571,152.95,160.57,Ses02F_script03_1_F021,hap,4,2.6667,3.6667,"Yes, meaning just that.",4
2572,162.7044,164.74,Ses02F_script03_1_F022,hap,4,2.3333,2,"Oh, what does it all mean?  That's what I ask myself in my ceaseless quest for ultimate truth.  Dear God, what does it all mean?",4
2573,168.43,173.2,Ses02F_script03_1_F023,hap,4.3333,3.3333,2.3333,Don't laugh at me.  I'm serious.,4
2574,174.19,179.85,Ses02F_script03_1_F024,hap,4,2.6667,3,"You mustn't be serious, my dear one.  That's just what they want.",4
2575,181.02,183.93,Ses02F_script03_1_F025,hap,4,3,3.3333,Who's they?,4
2576,187.4,191.65,Ses02F_script03_1_F026,hap,4.3333,4,3,All those futile moralists that try to make life unbearable.  Laugh at them.  Be flippant.  Laugh at everything.  All their sacred shibboleths.,4
2577,192.59,195.55,Ses02F_script03_1_F027,neu,3.3333,3,3.3333,Flippancy brings out the acid in their damn sweetness and light.,0
2578,197.09,204.39,Ses02F_script03_1_F028,hap,4.6667,4,3,"If I laugh at everything, then I must laugh at us too.",4
2579,204.84,208.53,Ses02F_script03_1_F029,exc,4,2.6667,2.6667,"Certainly, you must.  We're figures of fun, alright.",5
2582,7.71,8.8,Ses02F_script03_1_M001,neu,3,2,2.6667,"Well, shall we always want to bicker and fight?",0
2585,20.65,22.18,Ses02F_script03_1_M004,neu,3.6667,2.3333,4,Depends on how well we've played.,0
2586,23.91,28.8,Ses02F_script03_1_M005,neu,3.3333,4,2.6667,"Well, what happens if one of us dies?  I mean, does the one that's left still laugh?",0
2588,36.53,38.4,Ses02F_script03_1_M007,neu,3.6667,2.6667,3,"That's serious enough, isn't it?",0
2589,41.2,45.89,Ses02F_script03_1_M008,neu,3.6667,2.6667,3,"No. No, it isn't.  Death is very laughable.  Such a cunning little mystery.  All done with mirrors.",0
2590,48.15,50.17,Ses02F_script03_1_M009,neu,3,2,3.6667,"Darling, I believe you're talking nonsense.",0
2591,53.18,56.93,Ses02F_script03_1_M010,neu,3.6667,3,2.6667,So is everyone else in the long run.,0
2593,68,70.94,Ses02F_script03_1_M012,neu,3.6667,3.3333,3.6667,"Come and kiss me, darling, before your body rots and worms pop in and out of your eye sockets.",0
2594,71.42,78.64,Ses02F_script03_1_M013,neu,3.3333,3.6667,3.6667,"Elliott, worms don't pop.",0
2595,78.65,82.14,Ses02F_script03_1_M014,neu,3.6667,3.6667,3.6667,"I don't care what you do.  See, you could paint yourself green and dance naked in the Place Vendome and rush off madly with all the men in the world and I shan't say a word.  As long as you love me best.",0
2596,84.5,87.28,Ses02F_script03_1_M015,neu,3.6667,2.6667,3.3333,"Oh, thank you, dear.  The same applies to you except that if I catch so much as looking at another woman, I'll kill you.",0
2597,92.01,93.37,Ses02F_script03_1_M016,neu,3.3333,2,2.6667,You remember that awful scene we had in Venice?,0
2598,96.23,99.74,Ses02F_script03_1_M017,neu,3,2.3333,2.6667,Which particular one?,0
2599,101.1,103.33,Ses02F_script03_1_M018,neu,3.3333,2.3333,3,The one when you bought that little painted wooden snake in the Piazza and put it on my bed.,0
2600,108.68,111.96,Ses02F_script03_1_M019,exc,3.6667,3,4,Charles.  That was his name.  Charles.  He did wriggle so beautifully.,5
2601,112.79,118.28,Ses02F_script03_1_M020,exc,3.6667,3.3333,3.3333,"Ah, horrible thing.  I hated it.",5
2602,119.48,122.22,Ses02F_script03_1_M021,neu,3,2.6667,3,"Yes, I know you did.  You threw it out of the window into the Grand Canal.  I don't think I'll ever forgive you for that.",0
2603,122.26,136.21,Ses02F_script03_1_M022,exc,4,3,4.3333,How long did that row last?,5
2604,136.2304,140.63,Ses02F_script03_1_M023,exc,4,3,4.6667,It went in intermittently for days.,5
